{"action":"BLOCK_TOOL","activation_status":"not_activated","attempt_id":"attempt-p0-001","claim_blockers":["UNSAFE_ARTIFACT_ROOT"],"decision_id":"decision-p0-001","decision_sha256":"b0fbc1cc3f143a572604bd5c5245ac2cdb99cd72526c7b7e488d485ab1e06c6b","descriptor_id":"desc-p0-001","phase":"pre_activation","receipt_id":"receipt-p0-001","reread_attempts":0,"schema_version":"v1","selection_snapshot_id":"snapshot-p0-001"}
